{
  "$schema": "https://json-schema.org/draft/2020-12/schema",
  "$id": "https://lattice.dev/schemas/shop.schema.json",
  "title": "ShopDef",
  "description": "Shop definition (plan/02 \u00A76): stock plus buy/sell price formulas evaluated with the item\u0027s BasePrice and the trading entity\u0027s stats in scope.",
  "type": "object",
  "properties": {
    "id": {
      "type": "string",
      "description": "Globally unique def ID."
    },
    "type": {
      "const": "shop"
    },
    "description": {
      "type": "string",
      "description": "One line for humans and LLMs (surfaced by the manifest)."
    },
    "inherits": {
      "type": "string",
      "description": "Parent def ID (same kind); objects deep-merge, scalars override, arrays replace or take {\u0022$append\u0022/\u0022$remove\u0022} patches.",
      "x-lattice-ref": "shop"
    },
    "name": {
      "type": "string"
    },
    "currency": {
      "type": "string",
      "x-lattice-ref": "item",
      "description": "Currency item ID exchanged in trades."
    },
    "buyPriceFormula": {
      "type": "string",
      "description": "Price the customer pays when buying from the shop."
    },
    "sellPriceFormula": {
      "type": "string",
      "description": "Price the customer receives when selling to the shop."
    },
    "stock": {
      "type": "array",
      "items": {
        "type": "object",
        "properties": {
          "item": {
            "type": "string"
          },
          "count": {
            "type": "number"
          }
        }
      }
    },
    "restockOn": {
      "type": "string",
      "description": "Event topic that resets stock to this def (e.g. \u0022Time.DayStarted\u0022, live in M5)."
    },
    "openWhen": {
      "type": "array",
      "items": {
        "type": "object",
        "x-lattice-union": "condition",
        "description": "A condition primitive payload; see the manifest for arg signatures.",
        "properties": {
          "type": {
            "type": "string",
            "enum": [
              "AgentCondition",
              "AgentMeta",
              "All",
              "Any",
              "BeliefEquals",
              "FlagEquals",
              "FormulaTrue",
              "HasItem",
              "HasTag",
              "NeedBelow",
              "Not",
              "StatAtLeast",
              "UtilityAtLeast"
            ]
          }
        },
        "required": [
          "type"
        ]
      },
      "description": "Condition primitives (subject = the customer) gating trade \u2014 shop hours live here."
    }
  },
  "required": [
    "id",
    "type"
  ]
}