[
  {
    "id": "shop_innkeeper",
    "type": "shop",
    "name": "The Wolf's Rest",
    "description": "The innkeeper's bar: Charisma haggles the ale price down; closed for the night (openWhen reads the is_night day-phase flag).",
    "buyPriceFormula": "BasePrice * (2.0 - Charisma * 0.01)",
    "sellPriceFormula": "BasePrice * (0.4 + Charisma * 0.01)",
    "restockOn": "Time.DayStarted",
    "openWhen": [
      { "type": "Not", "condition": { "type": "FlagEquals", "flag": "is_night", "value": true } }
    ],
    "stock": [
      { "item": "item_ale", "count": 12 },
      { "item": "item_healing_potion", "count": 3 }
    ]
  },
  {
    "id": "shop_trader",
    "type": "shop",
    "name": "Wandering Trader",
    "description": "Charisma lowers buy prices and raises sell prices.",
    "buyPriceFormula": "BasePrice * (2.0 - Charisma * 0.01)",
    "sellPriceFormula": "BasePrice * (0.4 + Charisma * 0.01)",
    "restockOn": "Time.DayStarted",
    "openWhen": [
      { "type": "Not", "condition": { "type": "FlagEquals", "flag": "is_night", "value": true } }
    ],
    "stock": [
      { "item": "item_iron_sword", "count": 2 },
      { "item": "item_healing_potion", "count": 5 }
    ]
  }
]
